FDC_ID,Item,Category,Calorias_kcal,Proteinas_g,Carbohidratos_g,GrasaTotal_g,Colesterol_mg,Fibra_g,Agua_g,Alcohol_g,VitaminaC_mg
171917,"Beverages, tea, green, brewed, regular",Beverages,1.0,0.22,0.0,0.0,0.0,0.0,99.93,0.0,0.0
171918,"Beverages, tea, instant, lemon, with added ascorbic acid",Beverages,385.0,0.6,97.6,0.3,0.0,0.0,0.3,,100.0
171919,"Alcoholic beverage, distilled, all (gin, rum, vodka, whiskey) 86 proof",Beverages,250.0,0.0,0.1,0.0,0.0,0.0,63.9,36.0,0.0
171920,"Alcoholic beverage, distilled, all (gin, rum, vodka, whiskey) 90 proof",Beverages,263.0,0.0,0.0,0.0,0.0,0.0,62.1,37.9,0.0
171921,"Carbonated beverage, chocolate-flavored soda",Beverages,42.0,0.0,10.7,0.0,0.0,0.0,89.2,0.0,0.0
171922,"Beverages, water, bottled, non-carbonated, EVIAN",Beverages,0.0,0.0,0.0,0.0,,,99.97,,
171923,"Beverages, Powerade Zero Ion4, calorie-free, assorted flavors",Beverages,0.0,0.0,0.0,0.0,0.0,0.0,99.89,0.0,2.5
171924,"Beverages, WENDY'S, tea, ready-to-drink, unsweetened",Beverages,1.0,0.22,0.0,0.0,,,99.79,,
171925,"Alcoholic Beverage, wine, table, red, Merlot",Beverages,83.0,0.07,2.51,0.0,,0.0,86.59,10.6,0.0
171926,"Water, non-carbonated, bottles, natural fruit flavors, sweetened with low calorie sweetener",Beverages,1.0,0.0,0.13,0.0,0.0,0.0,99.85,0.0,0.0
171927,"Beverages, V8 SPLASH Juice Drinks, Diet Tropical Blend",Beverages,4.0,0.0,1.26,0.0,,,98.8,,25.2
171928,"Beverages, V8 SPLASH Juice Drinks, Berry Blend",Beverages,29.0,0.0,7.41,0.0,,,92.2,,24.7
171929,"Beverages, V8 SPLASH Juice Drinks, Fruit Medley",Beverages,33.0,0.0,7.82,0.0,,,91.8,,24.7
171930,"Beverages, V8 SPLASH Juice Drinks, Guava Passion Fruit",Beverages,33.0,0.0,7.82,0.0,,,91.9,,24.7
171931,"Beverages, V8 SPLASH Juice Drinks, Strawberry Kiwi",Beverages,29.0,0.0,7.41,0.0,,,92.4,,24.7
171932,"Beverages, V8 SPLASH Juice Drinks, Tropical Blend",Beverages,29.0,0.0,7.41,0.0,,,92.4,,24.7
171933,"Beverages, V8 V-FUSION Juices, Peach Mango",Beverages,49.0,0.41,11.38,0.0,,0.0,87.8,,24.4
171934,"Beverages, V8 V-FUSION Juices, Strawberry Banana",Beverages,49.0,0.41,11.79,0.0,,0.0,87.9,,24.4
171935,"Beverages, Energy Drink, Monster, fortified with vitamins C, B2, B3, B6, B12",Beverages,47.0,0.47,11.28,0.0,0.0,0.0,88.05,0.0,0.0
171936,"Beverages, Energy drink, AMP, sugar free",Beverages,2.0,0.0,1.03,0.0,0.0,0.0,98.35,0.0,0.0
171937,"Beverages, Energy drink, ROCKSTAR",Beverages,58.0,0.34,12.7,0.22,0.0,0.0,87.08,0.0,0.0
171938,"Beverages, Energy drink, ROCKSTAR, sugar free",Beverages,4.0,0.25,0.7,0.08,0.0,0.0,98.35,0.0,0.0
171939,"Beverages, Meal supplement drink, canned, peanut flavor",Beverages,101.0,3.5,14.74,3.07,,,77.79,,0.7
171940,"Water, with corn syrup and/or sugar and low calorie sweetener, fruit flavored",Beverages,18.0,0.0,4.5,0.0,0.0,0.0,94.44,0.0,12.7
171941,"Beverages, Horchata, as served in restaurant",Beverages,54.0,0.48,11.52,0.71,,0.0,87.1,,
171942,"Beverages, rice milk, unsweetened",Beverages,47.0,0.28,9.17,0.97,0.0,0.3,89.28,0.0,0.0
171943,"Beverages, Energy drink, VAULT, citrus flavor",Beverages,49.0,0.0,12.99,0.0,0.0,0.0,86.73,0.0,0.0
171944,"Beverages, Fruit flavored drink, reduced sugar, greater than 3% fruit juice, high vitamin C, added calcium",Beverages,29.0,0.0,6.67,0.37,0.0,0.0,93.0,0.0,25.0
171945,"Beverages, fruit juice drink, greater than 3% fruit juice, high vitamin C and added thiamin",Beverages,54.0,0.13,13.16,0.0,0.0,0.1,86.39,0.0,25.4
171946,"Beverages, tea, hibiscus, brewed",Beverages,0.0,0.0,0.0,0.0,0.0,0.0,99.58,0.0,0.0
171947,"Beverages, fruit juice drink, greater than 3% juice, high vitamin C",Beverages,46.0,0.13,11.35,0.11,0.0,0.1,88.1,0.0,25.0
173162,"Beverages, MONSTER energy drink, low carb",Beverages,5.0,0.0,1.38,0.0,0.0,0.0,98.35,0.0,0.0
173163,"Beverages, Whiskey sour mix, powder",Beverages,383.0,0.6,97.3,0.1,0.0,0.0,0.6,0.0,2.7
173164,"Alcoholic beverage, whiskey sour, prepared with water, whiskey and powder mix",Beverages,164.0,0.1,15.85,0.02,0.0,0.0,69.15,14.6,0.4
173165,"Beverages, THE COCA-COLA COMPANY, NOS energy drink, Original, grape, loaded cherry, charged citrus, fortified with vitamins B6 and B12",Beverages,44.0,0.0,11.25,0.0,0.0,0.0,88.45,0.0,0.0
173166,"Beverages, water, bottled, yumberry, pomegranate with anti-oxidants, zero calories",Beverages,5.0,0.0,1.25,0.0,0.0,0.0,98.75,0.0,25.0
173167,"Beverages, ABBOTT, EAS whey protein powder",Beverages,385.0,66.67,17.95,5.13,205.0,0.0,6.61,0.0,0.8
173168,"Alcoholic beverage, creme de menthe, 72 proof",Beverages,371.0,0.0,41.6,0.3,0.0,0.0,28.3,29.8,0.0
173169,"Beverages, NESTLE, Boost plus, nutritional drink, ready-to-drink",Beverages,138.0,5.38,17.29,5.38,4.0,1.2,71.1,0.0,23.1
173170,"Beverages, SLIMFAST, Meal replacement,  High Protein Shake, Ready-To-Drink, 3-2-1 plan",Beverages,61.0,6.59,0.85,3.38,4.0,0.4,88.57,0.0,19.4
173171,"Beverages, UNILEVER, SLIMFAST, meal replacement, regular, ready-to-drink,  3-2-1 Plan",Beverages,57.0,3.32,7.74,1.93,3.0,1.6,85.69,0.0,19.4
173172,"Beverages, UNILEVER, SLIMFAST Shake Mix, powder, 3-2-1 Plan",Beverages,448.0,8.13,73.92,13.34,5.0,18.1,1.99,0.0,1.3
173173,"Beverages, FUZE, orange mango, fortified with vitamins A, C, E, B6",Beverages,38.0,0.68,9.2,0.06,0.0,0.2,87.97,0.0,24.0
173174,"Beverages, UNILEVER, SLIMFAST Shake Mix, high protein, whey powder, 3-2-1 Plan,",Beverages,433.0,27.87,50.0,13.46,6.0,18.2,5.4,0.0,103.8
173175,"Beverages, Acai berry drink, fortified",Beverages,62.0,0.83,12.83,0.83,0.0,1.2,84.88,0.0,42.1
173176,"Alcoholic beverage, wine, dessert, sweet",Beverages,160.0,0.2,13.69,0.0,0.0,0.0,70.51,15.3,0.0
173177,"Beverages, Whey protein powder isolate",Beverages,359.0,58.14,29.07,1.16,12.0,0.0,0.86,0.0,34.9
173178,"Beverages, Orange juice, light, No pulp",Beverages,21.0,0.21,5.42,0.0,0.0,0.0,94.19,0.0,30.0
173179,"Beverages, The COCA-COLA company, Hi-C Flashin' Fruit Punch",Beverages,45.0,0.0,12.5,0.0,0.0,0.0,87.49,0.0,30.0
173180,"Beverages, Protein powder whey based",Beverages,352.0,78.13,6.25,1.56,16.0,3.1,3.44,0.0,0.0
173181,"Beverages, Protein powder soy based",Beverages,388.0,55.56,28.89,5.56,0.0,6.7,4.13,0.0,0.0
173182,"Beverages, rich chocolate, powder",Beverages,372.0,0.0,92.96,0.0,0.0,0.0,1.28,0.0,54.5
173183,"Beverages, GEROLSTEINER BRUNNEN GmbH & Co. KG (Gerolsteiner), naturally sparkling, mineral bottled water",Beverages,0.0,0.0,0.0,0.0,0.0,0.0,99.95,0.0,0.0
173184,"Beverages, chocolate malt, powder, prepared with fat free milk",Beverages,49.0,3.25,8.64,0.17,2.0,0.0,86.95,0.0,3.3
173185,"Alcoholic beverage, wine, table, all",Beverages,83.0,0.07,2.72,0.0,0.0,0.0,86.58,10.4,0.0
173186,"Beverages, V8 SPLASH Smoothies, Peach Mango",Beverages,37.0,1.22,7.76,0.0,0.0,0.0,90.69,,24.5
173187,"Beverages, chocolate almond milk, unsweetened, shelf-stable, fortified with vitamin D2 and E",Beverages,21.0,0.83,1.25,1.46,0.0,0.4,95.78,0.0,0.0
173188,"Beverages, The COCA-COLA company, Glaceau Vitamin Water, Revive Fruit Punch, fortified",Beverages,0.0,0.0,0.0,0.0,0.0,0.0,99.17,0.0,10.2
173189,"Beverages, MINUTE MAID, Lemonada, Limeade",Beverages,50.0,0.0,13.75,0.0,0.0,0.0,86.08,0.0,3.1
173190,"Alcoholic beverage, wine, table, red",Beverages,85.0,0.07,2.61,0.0,0.0,0.0,86.49,10.6,0.0
173191,"Alcoholic Beverage, wine, table, red, Barbera",Beverages,85.0,0.07,2.79,0.0,,,86.29,10.6,
173192,"Alcoholic Beverage, wine, table, red, Zinfandel",Beverages,88.0,0.07,2.86,0.0,,,85.71,11.1,
173193,"Alcoholic Beverage, wine, table, red, Petite Sirah",Beverages,85.0,0.07,2.68,0.0,,,86.22,10.7,
173194,"Alcoholic Beverage, wine, table, red, Claret",Beverages,83.0,0.07,3.01,0.0,,,86.38,10.2,
173195,"Alcoholic beverage, wine, table, white, Chenin Blanc",Beverages,80.0,0.07,3.31,0.0,,,86.78,9.6,
173196,"Alcoholic beverage, wine, table, white, Fume Blanc",Beverages,82.0,0.07,2.27,0.0,,,86.98,10.5,
173197,"Beverages, Mixed vegetable and fruit juice drink, with added nutrients",Beverages,29.0,0.04,7.47,0.01,0.0,0.0,92.34,0.0,32.5
173198,"Alcoholic beverage, wine, table, white, Muller Thurgau",Beverages,76.0,0.07,3.48,0.0,,,87.28,9.0,
173199,"Carbonated beverage, cream soda",Beverages,51.0,0.0,13.3,0.0,0.0,0.0,86.7,0.0,0.0
173200,"Alcoholic beverage, wine, table, white, Riesling",Beverages,80.0,0.07,3.74,0.0,,,86.56,9.5,
173201,"Alcoholic beverage, wine, table, white, Sauvignon Blanc",Beverages,81.0,0.07,2.05,0.0,,,87.16,10.5,
173202,"Alcoholic beverage, wine, table, white, late harvest",Beverages,112.0,0.07,13.39,0.0,,,77.76,8.5,
173203,"Beverages, carbonated, grape soda",Beverages,43.0,0.0,11.2,0.0,0.0,0.0,88.8,0.0,0.0
173204,"Beverages, carbonated, low calorie, other than cola or pepper,  without caffeine",Beverages,0.0,0.1,0.0,0.0,0.0,0.0,99.8,0.0,0.0
173205,"Beverages, carbonated, lemon-lime soda, no caffeine",Beverages,41.0,0.09,10.42,0.0,0.0,0.0,89.49,0.0,0.0
173206,"Beverages, carbonated, SPRITE, lemon-lime, without caffeine",Beverages,40.0,0.05,10.14,0.02,0.0,0.0,89.78,0.0,0.0
173207,"Beverages, carbonated, low calorie, other than cola or pepper, with aspartame, contains caffeine",Beverages,0.0,0.1,0.0,0.0,0.0,0.0,99.8,0.0,0.0
173208,"Alcoholic Beverage, wine, table, red, Burgundy",Beverages,86.0,0.07,3.69,0.0,,,85.62,10.3,
173209,"Beverages, carbonated, pepper-type, contains caffeine",Beverages,41.0,0.0,10.4,0.1,0.0,0.0,89.4,,0.0
173210,"Beverages, Energy drink, RED BULL",Beverages,43.0,0.46,10.23,0.0,0.0,0.0,89.22,0.0,0.0
173211,"Beverages, tea, black, ready to drink, decaffeinated, diet",Beverages,0.0,0.0,0.83,0.0,0.0,0.0,99.14,0.0,0.0
173212,"Beverages, tea, black, ready to drink, decaffeinated",Beverages,38.0,0.0,8.75,0.0,0.0,0.0,91.22,0.0,0.0
173213,"Beverages, grape juice drink, canned",Beverages,57.0,0.0,14.55,0.0,0.0,0.1,85.3,0.0,26.5
173214,"Beverages, Cranberry juice cocktail",Beverages,52.0,0.0,12.25,0.34,,,87.39,,33.5
173215,"Beverages, SNAPPLE, tea, black and green, ready to drink, peach, diet",Beverages,2.0,0.1,0.1,0.0,0.0,0.0,99.8,,0.0
173216,"Lemonade, frozen concentrate, white",Beverages,196.0,0.22,49.89,0.7,0.0,0.3,49.06,0.0,13.1
173217,"Lemonade, frozen concentrate, white, prepared with water",Beverages,40.0,0.07,10.42,0.04,0.0,0.0,89.35,0.0,3.9
173218,"Beverages, SNAPPLE, tea, black and green, ready to drink, lemon, diet",Beverages,2.0,0.1,0.1,0.0,0.0,0.0,99.8,,0.0
173219,"Beverages, Malted drink mix, natural, with added nutrients, powder, prepared with whole milk",Beverages,86.0,3.67,10.67,3.21,11.0,0.0,81.49,0.0,10.4
173220,"Beverages, Malted drink mix, natural, powder, dairy based.",Beverages,428.0,14.29,71.21,9.52,24.0,0.1,2.0,0.0,2.9
173221,"Beverages, Malted drink mix, natural, powder, prepared with whole milk",Beverages,88.0,3.86,10.23,3.62,12.0,0.1,81.4,0.0,0.2
173222,"Beverages, OVALTINE, chocolate malt powder",Beverages,372.0,0.0,92.96,0.0,0.0,0.0,1.28,0.0,54.5
173223,"Beverages, orange and apricot juice drink, canned",Beverages,51.0,0.3,12.7,0.1,0.0,0.1,86.7,0.0,20.0
173224,"Beverages, pineapple and grapefruit juice drink, canned",Beverages,47.0,0.2,11.6,0.1,0.0,0.1,87.9,0.0,46.0
173225,"Beverages, pineapple and orange juice drink, canned",Beverages,50.0,1.3,11.8,0.0,0.0,0.1,86.9,0.0,22.5
173226,"Shake, fast food, vanilla",Beverages,148.0,3.37,19.59,6.52,23.0,0.9,69.65,0.0,0.0
173227,"Beverages, tea, black, brewed, prepared with tap water",Beverages,1.0,0.0,0.3,0.0,0.0,0.0,99.7,0.0,0.0
173228,"Beverages, tea, instant, decaffeinated, lemon, diet",Beverages,338.0,3.3,85.4,0.6,0.0,0.0,3.5,0.0,0.0
173229,"Beverages, tea, instant, decaffeinated, lemon, sweetened",Beverages,401.0,0.12,98.55,0.73,0.0,0.0,0.13,0.0,0.0
173230,"Beverages, tea, instant, unsweetened, powder",Beverages,315.0,20.21,58.66,0.0,0.0,8.5,5.09,0.0,0.0
173231,"Beverages, tea, instant, lemon, diet",Beverages,2.0,0.02,0.44,0.0,0.0,0.0,99.41,0.0,0.0
173232,"Beverages, tea, herb, other than chamomile, brewed",Beverages,1.0,0.0,0.2,0.0,0.0,0.0,99.7,0.0,0.0
173233,"Beverages, water, bottled, PERRIER",Beverages,0.0,0.0,0.0,0.0,0.0,0.0,99.9,,0.0
173234,"Beverages, water, bottled, POLAND SPRING",Beverages,0.0,0.0,0.0,0.0,0.0,0.0,100.0,,0.0
173235,"Beverages, orange-flavor drink, breakfast type, powder",Beverages,386.0,0.0,98.94,0.0,0.0,0.4,0.14,0.0,230.8
173236,"Beverages, orange-flavor drink, breakfast type, powder, prepared with water",Beverages,49.0,0.0,12.65,0.0,0.0,0.1,87.15,0.0,29.5
173237,"Beverages, Orange-flavor drink, breakfast type, low calorie, powder",Beverages,217.0,3.6,85.9,0.0,0.0,3.8,1.8,0.0,2400.0
173647,"Beverages, water, tap, drinking",Beverages,0.0,0.0,0.0,0.0,0.0,0.0,99.9,0.0,0.0
173648,"Beverages, coffee substitute, cereal grain beverage, powder, prepared with whole milk",Beverages,65.0,3.3,5.6,3.3,13.0,0.1,87.0,,0.9
173649,"Beverages, Dairy drink mix, chocolate, reduced calorie, with low-calorie sweeteners, powder",Beverages,329.0,25.0,51.4,2.6,24.0,9.4,12.8,0.0,5.6
173650,"Beverages, dairy drink mix, chocolate, reduced calorie, with aspartame, powder, prepared with water and ice",Beverages,29.0,2.19,4.51,0.23,2.0,0.8,92.26,0.0,0.5
173651,"Beverages, Orange-flavor drink, breakfast type, with pulp, frozen concentrate.",Beverages,172.0,0.1,42.9,0.5,0.0,0.2,55.2,0.0,243.1
173652,"Beverages, Orange-flavor drink, breakfast type, with pulp, frozen concentrate, prepared with water",Beverages,49.0,0.03,12.21,0.14,0.0,0.0,87.18,0.0,69.2
173653,"Cranberry juice cocktail, frozen concentrate",Beverages,201.0,0.05,51.45,0.0,0.0,0.2,48.4,,45.8
173654,"Cranberry juice cocktail, frozen concentrate, prepared with water",Beverages,47.0,0.01,11.81,0.0,0.0,0.0,88.08,0.0,10.5
173655,"Beverages, water, bottled, non-carbonated, DANNON",Beverages,0.0,0.0,0.0,0.0,,,99.98,,
173656,"Beverages, water, bottled, non-carbonated, PEPSI, AQUAFINA",Beverages,0.0,0.0,0.0,0.0,,,99.97,,
173657,"Water, bottled, non-carbonated, NAYA",Beverages,0.0,0.0,0.0,0.0,,,100.0,,
173658,"Beverages, DANNON, water, bottled, non-carbonated, with Fluoride",Beverages,0.0,0.0,0.03,0.0,,,99.97,,
173659,"Beverages, drink mix, QUAKER OATS, GATORADE, orange flavor, powder",Beverages,388.0,0.0,94.11,1.23,0.0,0.0,2.51,,0.4
173660,"Beverages, PEPSICO QUAKER, Gatorade, G performance O 2, ready-to-drink.",Beverages,26.0,0.0,6.43,0.0,0.0,0.0,93.38,0.0,0.4
173661,"Whiskey sour mix, bottled, with added potassium and sodium",Beverages,84.0,0.1,21.4,0.1,0.0,0.0,78.2,0.0,2.7
173662,"Alcoholic beverage, whiskey sour",Beverages,149.0,0.0,13.17,0.03,0.0,0.0,72.6,14.1,1.6
173663,"Alcoholic beverage, distilled, all (gin, rum, vodka, whiskey) 94 proof",Beverages,275.0,0.0,0.0,0.0,0.0,0.0,60.3,39.7,0.0
173664,"Alcoholic beverage, distilled, all (gin, rum, vodka, whiskey) 100 proof",Beverages,295.0,0.0,0.0,0.0,0.0,0.0,57.5,42.5,0.0
173665,"Alcoholic beverage, liqueur, coffee, 63 proof",Beverages,308.0,0.1,32.2,0.3,0.0,0.0,41.4,26.0,0.0
173666,"Lemonade, frozen concentrate, pink",Beverages,192.0,0.22,48.86,0.69,0.0,0.3,50.09,0.0,14.1
173667,"Beverages, lemonade, frozen concentrate, pink, prepared with water",Beverages,43.0,0.05,10.81,0.15,0.0,0.1,88.88,0.0,3.1
174108,"Beverages,  Energy drink, Citrus",Beverages,45.0,0.0,11.27,0.0,0.0,0.0,88.45,0.0,25.0
174109,"Alcoholic Beverage, wine, table, red, Mouvedre",Beverages,88.0,0.07,2.64,0.0,,,85.81,11.2,
174110,"Alcoholic beverage, wine, table, white, Chardonnay",Beverages,84.0,0.07,2.16,0.0,,0.0,86.85,10.7,0.0
174111,"Beverages, Kiwi Strawberry Juice Drink",Beverages,47.0,0.0,12.26,0.0,0.0,0.0,87.74,0.0,24.7
174112,"Beverages, Apple juice drink, light, fortified with vitamin C",Beverages,22.0,0.0,5.1,0.1,0.0,0.0,94.84,0.0,24.0
174113,"Beverages, POWERADE, Zero, Mixed Berry",Beverages,0.0,0.0,0.14,0.0,0.0,0.0,99.35,0.0,0.0
174114,"Beverages, Carob-flavor beverage mix, powder",Beverages,372.0,1.8,93.3,0.2,0.0,8.0,2.9,,0.0
174115,"Beverages, Carob-flavor beverage mix, powder, prepared with whole milk",Beverages,75.0,3.16,8.68,3.11,10.0,0.4,84.32,,0.0
174116,"Beverages, coconut milk, sweetened, fortified with calcium, vitamins A, B12, D2",Beverages,31.0,0.21,2.92,2.08,0.0,0.0,94.57,0.0,0.0
174117,"Beverages, chocolate syrup",Beverages,279.0,2.1,65.1,1.13,0.0,2.6,31.0,0.0,0.2
174118,"Beverages, chocolate syrup, prepared with whole milk",Beverages,90.0,3.07,12.78,2.96,9.0,0.3,80.51,0.0,0.0
174119,"Beverages, coffee, ready to drink, iced, mocha, milk based",Beverages,60.0,1.48,11.42,0.98,0.0,0.0,85.68,0.0,0.0
174120,"Beverages, tea, Oolong, brewed",Beverages,1.0,0.0,0.15,0.0,0.0,0.0,99.84,0.0,0.0
174121,"Beverages, tea, green, ready-to-drink, citrus, diet, fortified with vitamin C",Beverages,1.0,0.0,0.31,0.0,0.0,0.0,99.62,0.0,39.3
174122,"Beverages, Cocoa mix, powder",Beverages,398.0,6.67,83.73,4.0,0.0,3.7,1.5,0.0,0.2
174123,"Beverages, Cocoa mix, powder, prepared with water",Beverages,55.0,0.92,11.54,0.55,0.0,0.5,86.34,0.0,0.0
174124,"Beverages, Cocoa mix, NESTLE, Hot Cocoa Mix Rich Chocolate With Marshmallows",Beverages,400.0,2.8,75.0,15.0,0.0,3.7,4.18,,0.0
174125,"Beverages, coffee, brewed, espresso, restaurant-prepared, decaffeinated",Beverages,9.0,0.1,1.69,0.18,0.0,0.0,97.8,0.0,0.2
174126,"Beverages, coffee, instant, regular, half the caffeine",Beverages,352.0,14.42,73.18,0.5,0.0,0.0,3.1,0.0,0.0
174127,"Beverages, coffee and cocoa, instant, decaffeinated, with whitener and low calorie sweetener",Beverages,440.0,9.0,71.4,13.21,0.0,4.8,3.1,0.0,0.0
174128,"Beverages, tea, green, ready-to-drink, sweetened",Beverages,27.0,0.0,6.2,0.22,0.0,0.0,93.54,0.0,0.0
174129,"Beverages, tea, ready-to-drink, lemon, diet",Beverages,2.0,0.0,0.41,0.0,0.0,0.0,99.55,0.0,0.0
174130,"Beverages, coffee, instant, regular, prepared with water",Beverages,2.0,0.1,0.34,0.0,0.0,0.0,99.09,0.0,0.0
174131,"Beverages, aloe vera juice drink, fortified with Vitamin C",Beverages,15.0,0.0,3.75,0.0,0.0,0.0,96.23,0.0,3.8
174132,"Beverages, OCEAN SPRAY, Cran Grape",Beverages,54.0,0.21,13.16,0.0,1.0,0.6,86.5,0.0,28.1
174133,"Beverages, coffee, instant, decaffeinated, powder",Beverages,351.0,11.6,76.0,0.2,0.0,0.0,3.2,0.0,0.0
174134,"Beverages, coffee, instant, chicory",Beverages,3.0,0.09,0.75,0.0,0.0,0.0,98.94,0.0,0.0
174135,"Beverages, coffee, instant, mocha, sweetened",Beverages,460.0,5.29,74.04,15.87,0.0,1.9,1.7,0.0,0.6
174136,"Beverages, OCEAN SPRAY, Light Cranberry and Raspberry Flavored Juice",Beverages,26.0,0.73,5.77,0.0,0.0,0.7,93.8,0.0,32.9
174137,"Beverages, OCEAN SPRAY, White Cranberry Strawberry Flavored Juice Drink",Beverages,49.0,0.22,11.98,0.01,0.0,0.6,88.0,0.0,26.7
174138,"Beverages, coffee substitute, cereal grain beverage, powder",Beverages,360.0,6.01,78.42,2.52,0.0,23.3,7.99,0.0,0.0
174139,"Beverages, coffee substitute, cereal grain beverage, prepared with water",Beverages,6.0,0.1,1.3,0.04,0.0,0.4,98.37,0.0,0.0
174140,"Beverages, cranberry-apple juice drink, bottled",Beverages,63.0,0.0,15.85,0.11,0.0,0.0,83.78,0.0,39.5
174141,"Alcoholic beverage, malt beer, hard lemonade",Beverages,68.0,0.0,10.07,0.0,0.0,0.0,85.74,4.0,2.8
174142,"Beverages, cranberry-apricot juice drink, bottled",Beverages,64.0,0.2,16.2,0.0,0.0,0.1,83.5,,0.0
174143,"Beverages, tea, green, instant, decaffeinated, lemon, unsweetened, fortified with vitamin C",Beverages,378.0,0.0,94.45,0.0,0.0,0.0,5.09,0.0,1342.3
174144,"Beverages, tea, black, ready to drink",Beverages,0.0,0.0,0.0,0.0,0.0,0.0,97.89,0.0,0.0
174145,"Alcoholic beverage, beer, light, higher alcohol",Beverages,46.0,0.25,0.77,0.0,0.0,0.0,92.88,6.0,0.0
174146,"Beverages, AMBER, hard cider",Beverages,56.0,0.0,5.92,0.0,0.0,0.0,89.0,4.0,2.3
174147,"Beverages, OCEAN SPRAY, Cran Cherry",Beverages,46.0,0.19,12.76,0.0,0.0,0.6,87.0,0.0,24.4
174148,"Beverages, OCEAN SPRAY, Light Cranberry",Beverages,19.0,0.22,4.72,0.01,0.0,0.7,95.3,0.0,0.8
174149,"Beverages, OCEAN SPRAY, White Cranberry Peach",Beverages,45.0,0.13,11.88,0.01,0.0,0.6,87.8,0.0,27.1
174150,"Beverages, OCEAN SPRAY, Light Cranberry, Concord Grape",Beverages,23.0,0.36,5.78,0.02,0.0,0.7,93.4,0.0,34.1
174151,"Beverages, Fruit punch drink, with added nutrients, canned",Beverages,47.0,0.0,11.94,0.0,0.0,0.2,87.97,0.0,29.6
174152,"Beverages, Fruit punch drink, frozen concentrate",Beverages,162.0,0.2,41.4,0.0,0.0,0.4,58.2,,155.6
174153,"Beverages, Fruit punch drink, frozen concentrate, prepared with water",Beverages,46.0,0.06,11.66,0.0,0.0,0.1,88.15,0.0,43.8
174154,"Beverages, coffee, instant, vanilla, sweetened, decaffeinated, with non dairy creamer",Beverages,465.0,0.0,86.28,13.33,0.0,0.0,0.16,0.0,0.0
174155,"Beverages, tea, black, brewed, prepared with distilled water",Beverages,1.0,0.0,0.3,0.0,0.0,0.0,99.7,,0.0
174156,"Beverages, tea, herb, brewed, chamomile",Beverages,1.0,0.0,0.2,0.0,0.0,0.0,99.7,0.0,0.0
174157,"Beverages, Wine, non-alcoholic",Beverages,6.0,0.5,1.1,0.0,0.0,0.0,98.2,0.0,0.0
174158,"Water, bottled, generic",Beverages,0.0,0.0,0.0,0.0,0.0,0.0,99.98,0.0,0.0
174159,"Beverages, chocolate-flavor beverage mix for milk, powder, with added nutrients",Beverages,400.0,4.55,90.28,2.27,0.0,4.5,1.1,0.0,27.3
174160,"Beverages, chocolate-flavor beverage mix for milk, powder, with added nutrients, prepared with whole milk",Beverages,89.0,3.27,11.87,3.17,10.0,0.4,80.93,0.0,2.3
174161,"Beverages, Water with added vitamins and minerals, bottles, sweetened, assorted fruit flavors",Beverages,22.0,0.0,5.49,0.0,0.0,0.0,94.44,0.0,12.7
174162,"Beverages, V8 SPLASH Juice Drinks, Diet Berry Blend",Beverages,4.0,0.0,1.23,0.0,,,98.7,,24.7
174163,"Beverages, V8 SPLASH Juice Drinks, Diet Fruit Medley",Beverages,4.0,0.0,1.26,0.0,,,98.8,,25.2
174164,"Beverages, V8 SPLASH Juice Drinks, Diet Strawberry Kiwi",Beverages,4.0,0.0,1.26,0.0,,,98.8,,25.2
174165,"Beverages, V8 SPLASH Juice Drinks, Mango Peach",Beverages,33.0,0.0,8.23,0.0,,,91.6,,24.7
174166,"Beverages, V8 SPLASH Juice Drinks, Orange Pineapple",Beverages,29.0,0.0,7.41,0.0,,,91.9,,24.7
174167,"Beverages, V8 SPLASH Juice Drinks, Orchard Blend",Beverages,33.0,0.0,7.82,0.0,,,92.2,,24.7
174168,"Beverages, V8 SPLASH Juice Drinks, Strawberry Banana",Beverages,29.0,0.0,7.41,0.0,,,92.2,,24.7
174169,"Beverages, V8 V-FUSION Juices, Tropical",Beverages,49.0,0.41,11.38,0.0,,0.0,88.0,,24.4
174170,"Beverages, V8 V- FUSION Juices, Acai Berry",Beverages,45.0,0.0,10.98,0.0,0.0,0.0,88.4,,40.7
174171,"Beverages, Energy drink, AMP",Beverages,46.0,0.25,12.08,0.08,0.0,0.0,87.3,0.0,0.0
174172,"Beverages, Energy drink, FULL THROTTLE",Beverages,46.0,0.25,12.08,0.08,0.0,0.0,87.3,0.0,0.0
174173,"Beverages, Vegetable and fruit juice drink, reduced calorie, with low-calorie sweetener, added vitamin C",Beverages,4.0,0.0,1.1,0.0,0.0,0.0,98.78,0.0,25.1
174174,"Beverages, milk beverage, reduced fat, flavored and sweetened, Ready-to-drink,  added calcium, vitamin A and vitamin D",Beverages,77.0,3.05,12.08,1.83,8.0,0.4,82.32,0.0,0.2
174175,"Beverages, vegetable and fruit juice blend, 100% juice, with added vitamins A, C, E",Beverages,46.0,0.3,11.15,0.01,0.0,0.0,88.4,0.0,28.5
174176,"Beverages, fruit juice drink, reduced sugar, with vitamin E added",Beverages,39.0,0.0,10.0,0.07,0.0,0.0,87.58,0.0,0.0
174177,"Beverages, Energy drink, VAULT Zero, sugar-free, citrus flavor",Beverages,1.0,0.25,0.7,0.08,0.0,0.0,98.35,0.0,0.0
174178,"Beverages, PEPSICO QUAKER, Gatorade G2, low calorie",Beverages,8.0,0.05,1.94,0.01,0.0,0.0,97.94,0.0,0.0
174179,"Beverages, Fruit flavored drink, less than 3% juice, not fortified with vitamin C",Beverages,64.0,0.0,16.03,0.0,0.0,0.0,83.87,0.0,0.0
174180,"Beverages, Fruit flavored drink containing less than 3% fruit juice, with high vitamin C",Beverages,27.0,0.0,6.67,0.0,0.0,0.0,93.2,0.0,25.0
174181,"Beverages, nutritional shake mix, high protein, powder",Beverages,392.0,53.57,20.38,10.71,0.0,0.0,8.3,0.0,75.0
174809,"Beverages, THE COCA-COLA COMPANY, NOS Zero, energy drink, sugar-free with guarana, fortified with vitamins B6 and B12",Beverages,4.0,0.0,1.03,0.0,0.0,0.0,98.35,0.0,0.0
174810,"Alcoholic beverage, whiskey sour, canned",Beverages,119.0,0.0,13.4,0.0,0.0,0.1,76.9,9.5,1.6
174811,"Beverages, Whiskey sour mix, bottled",Beverages,87.0,0.1,21.4,0.1,0.0,0.0,78.2,0.0,2.7
174812,"Alcoholic beverage, whiskey sour, prepared from item 14028",Beverages,153.0,0.06,12.82,0.06,0.0,0.0,72.44,14.5,1.6
174813,"Beverages, ABBOTT, EAS soy protein powder",Beverages,405.0,47.62,43.94,3.57,0.0,0.0,2.83,0.0,0.0
174814,"Beverages, CYTOSPORT, Muscle Milk, ready-to-drink",Beverages,52.0,5.87,2.28,2.17,2.0,0.2,89.0,0.0,27.6
174815,"Alcoholic beverage, distilled, all (gin, rum, vodka, whiskey) 80 proof",Beverages,231.0,0.0,0.0,0.0,0.0,0.0,66.6,33.4,0.0
174816,"Beverages, OCEAN SPRAY, Cran-Energy, Cranberry Energy Juice Drink",Beverages,15.0,0.0,3.75,0.0,0.0,0.0,96.18,0.0,25.0
174817,"Alcoholic beverage, distilled, rum, 80 proof",Beverages,231.0,0.0,0.0,0.0,0.0,0.0,66.6,33.4,0.0
174818,"Alcoholic beverage, distilled, vodka, 80 proof",Beverages,231.0,0.0,0.0,0.0,0.0,0.0,66.6,33.4,0.0
174819,"Alcoholic beverage, distilled, whiskey, 86 proof",Beverages,250.0,0.0,0.1,0.0,0.0,0.0,63.9,36.0,0.0
174820,"Beverages, almond milk, chocolate, ready-to-drink",Beverages,50.0,0.63,9.38,1.25,0.0,0.4,88.43,0.0,4.4
174821,"Beverages, Energy Drink with carbonated water and high fructose corn syrup",Beverages,62.0,0.42,15.0,0.0,0.0,0.0,84.52,0.0,25.0
174822,"Beverages, Energy Drink, sugar free",Beverages,4.0,0.42,0.42,0.0,0.0,0.0,99.11,0.0,25.0
174823,"Beverages, ABBOTT, ENSURE, Nutritional Shake, Ready-to-Drink",Beverages,105.0,3.8,16.88,2.53,2.0,0.0,76.2,0.0,12.7
174824,"Beverages, chocolate powder, no sugar added",Beverages,350.0,9.09,68.31,4.5,0.0,9.1,7.4,0.0,54.5
174825,"Beverages, ZEVIA, cola",Beverages,0.0,0.0,1.13,0.0,0.0,0.0,98.36,0.0,0.0
174826,"Beverages, ZEVIA, cola, caffeine free",Beverages,0.0,0.0,1.13,0.0,0.0,0.0,98.87,0.0,0.0
174827,"Beverages, GEROLSTEINER BRUNNEN GmbH & Co. KG,Gerolsteiner naturally sparkling mineral water,",Beverages,0.0,0.0,0.0,0.0,0.0,0.0,99.95,0.0,0.0
174828,"Beverages, yellow green colored citrus soft drink with caffeine",Beverages,49.0,0.0,12.83,0.0,0.0,0.0,86.89,0.0,0.0
174829,"Beverages, V8 SPLASH Smoothies, Strawberry Banana",Beverages,37.0,1.22,8.16,0.0,0.0,0.0,90.28,,24.5
174830,"Beverages, V8 SPLASH Smoothies, Tropical Colada",Beverages,41.0,1.22,8.54,0.0,0.0,0.4,90.28,,24.4
